{
  "$schema": "https://json-schema.org/draft/2020-12/schema",
  "$id": "https://raw.githubusercontent.com/soccz/EcoGuard/v0.4.0/schemas/forest_case.schema.json",
  "title": "EcoGuard synthetic forest reference case",
  "type": "object",
  "additionalProperties": false,
  "required": [
    "schema_version",
    "case_id",
    "classification",
    "relation_to_trade_case",
    "files",
    "grid",
    "thresholds",
    "geojson_transform",
    "reference"
  ],
  "properties": {
    "schema_version": {"const": "2.0.0"},
    "case_id": {"type": "string", "minLength": 1},
    "classification": {"const": "synthetic_reference_mask_evaluation"},
    "relation_to_trade_case": {"type": "string", "minLength": 1},
    "files": {
      "type": "object",
      "additionalProperties": false,
      "required": ["pixels", "reference_mask"],
      "properties": {
        "pixels": {"type": "string", "pattern": "^[^/]+\\.csv$"},
        "reference_mask": {"type": "string", "pattern": "^[^/]+\\.csv$"}
      }
    },
    "grid": {
      "type": "object",
      "additionalProperties": false,
      "required": ["rows", "cols", "connectivity", "cell_width_m", "cell_height_m"],
      "properties": {
        "rows": {"type": "integer", "minimum": 1},
        "cols": {"type": "integer", "minimum": 1},
        "connectivity": {"enum": [4, 8]},
        "cell_width_m": {"type": "string", "pattern": "^(?:[1-9][0-9]*(?:\\.[0-9]+)?|0+\\.(?:[0-9]*[1-9][0-9]*))$"},
        "cell_height_m": {"type": "string", "pattern": "^(?:[1-9][0-9]*(?:\\.[0-9]+)?|0+\\.(?:[0-9]*[1-9][0-9]*))$"}
      }
    },
    "thresholds": {
      "type": "object",
      "additionalProperties": false,
      "required": ["forest_ndvi_min", "ndvi_decrease_min"],
      "properties": {
        "forest_ndvi_min": {"type": "string", "pattern": "^-?(?:0(?:\\.[0-9]+)?|1(?:\\.0+)?)$"},
        "ndvi_decrease_min": {"type": "string", "pattern": "^(?:[01](?:\\.[0-9]+)?|2(?:\\.0+)?)$"}
      }
    },
    "geojson_transform": {
      "type": "object",
      "additionalProperties": false,
      "required": [
        "kind",
        "top_left_lon",
        "top_left_lat",
        "pixel_width_deg",
        "pixel_height_deg",
        "row_direction"
      ],
      "properties": {
        "kind": {"const": "synthetic_wgs84"},
        "top_left_lon": {"type": "string", "pattern": "^-?[0-9]+(?:\\.[0-9]+)?$"},
        "top_left_lat": {"type": "string", "pattern": "^-?[0-9]+(?:\\.[0-9]+)?$"},
        "pixel_width_deg": {"type": "string", "pattern": "^(?:[1-9][0-9]*(?:\\.[0-9]+)?|0+\\.(?:[0-9]*[1-9][0-9]*))$"},
        "pixel_height_deg": {"type": "string", "pattern": "^(?:[1-9][0-9]*(?:\\.[0-9]+)?|0+\\.(?:[0-9]*[1-9][0-9]*))$"},
        "row_direction": {"const": "south"}
      }
    },
    "reference": {
      "type": "object",
      "additionalProperties": false,
      "required": ["label", "provenance"],
      "properties": {
        "label": {"type": "string", "minLength": 1},
        "provenance": {"type": "string", "minLength": 1}
      }
    }
  }
}
